{
  "schema_version": "1.0.0",
  "project": "ChangeBridge",
  "allowed_labels": [
    "DESIGN_ONLY",
    "LOCAL_VERIFIED",
    "AWS_VERIFIED",
    "MEASURED",
    "EXTRAPOLATED",
    "UNCLAIMED"
  ],
  "claims": [
    {
      "id": "CB-CLAIM-001",
      "source_claim_ids": ["PC-001", "BC-003"],
      "approved_wording": "The SQLite reference engine locally verifies contiguous frontiers, identical replay, conflicting replay rejection, tombstones, failure rollback, schema gates, reconciliation, and compare-and-swap publication.",
      "scope": "single-process SQLite correctness oracle",
      "label": "LOCAL_VERIFIED",
      "requirement_ids": ["CB-ORDER-002", "CB-APPLY-003", "CB-APPLY-004", "CB-APPLY-005", "CB-CHECKPOINT-002", "CB-RECON-003", "CB-PUBLISH-002", "CB-PUBLISH-003"],
      "proof_refs": ["src/changebridge/engine.py", "src/changebridge/simulator.py", "tests/", "evidence/local-simulation.json", "evidence/part1/stage1/stage_receipt.json"],
      "producing_commit": "d7e9cac800edfaf9e88f03dc6094ae07f43b496a",
      "producing_run": "35197120045",
      "limitations": "This is local reference-model proof, not DMS, Spark, Iceberg, DynamoDB, Step Functions, or distributed-runtime proof.",
      "public_surfaces": [{"path": "README.md", "marker": "CB-CLAIM-001"}, {"path": "CLAIMS.md", "marker": "CB-CLAIM-001"}, {"path": "docs/INTERVIEW_WALKTHROUGH.md", "marker": "CB-CLAIM-001"}],
      "review_status": "APPROVED",
      "owner": "part1-stage2",
      "invalidation_conditions": ["local engine or simulator semantics change", "referenced tests or evidence change", "producing commit becomes unreachable"],
      "disposition": "CORRECTED"
    },
    {
      "id": "CB-CLAIM-002",
      "source_claim_ids": ["PC-002", "BC-005"],
      "approved_wording": "The repository contains an accepted design-only architecture authority and a partial AWS reference topology; it does not contain a complete deployable migration platform or managed runtime proof.",
      "scope": "accepted architecture authority and partial Terraform declarations",
      "label": "DESIGN_ONLY",
      "requirement_ids": ["CB-OPS-002", "CB-OPS-003", "CB-SEC-001"],
      "proof_refs": ["architecture/", "docs/adr/", "infra/terraform/", "docs/architecture.md", "evidence/part1/stage3/claim-impact-review.json"],
      "producing_commit": "0a27be6a197fa6e849958957e7df1447f2b4f797",
      "producing_run": null,
      "limitations": "Source database, replication instance, Glue apply job, Step Functions state machine, budgets, lease controls, managed cutover, and teardown proof are absent.",
      "public_surfaces": [{"path": "README.md", "marker": "CB-CLAIM-002"}, {"path": "CLAIMS.md", "marker": "CB-CLAIM-002"}, {"path": "docs/INTERVIEW_WALKTHROUGH.md", "marker": "CB-CLAIM-002"}],
      "review_status": "APPROVED",
      "owner": "part1-stage3",
      "invalidation_conditions": ["architecture or Terraform topology changes", "managed deployment evidence is produced"],
      "disposition": "CORRECTED"
    },
    {
      "id": "CB-CLAIM-003",
      "source_claim_ids": ["PC-003"],
      "approved_wording": "ChangeBridge makes no AWS throughput, availability, recovery-time, scale, or cost claim because no qualifying managed measurement exists.",
      "scope": "managed operational metrics",
      "label": "UNCLAIMED",
      "requirement_ids": ["CB-OPS-003", "CB-OPS-004"],
      "proof_refs": [],
      "producing_commit": null,
      "producing_run": null,
      "limitations": "Future measurements require a bounded workload, raw observations, exact run lineage, and teardown evidence.",
      "public_surfaces": [{"path": "README.md", "marker": "CB-CLAIM-003"}, {"path": "CLAIMS.md", "marker": "CB-CLAIM-003"}, {"path": "docs/INTERVIEW_WALKTHROUGH.md", "marker": "CB-CLAIM-003"}],
      "review_status": "UNCLAIMED",
      "owner": "part3-managed-proof",
      "invalidation_conditions": ["qualifying measurements are produced and independently reviewed"],
      "disposition": "FROZEN"
    },
    {
      "id": "CB-CLAIM-004",
      "source_claim_ids": ["PC-004"],
      "approved_wording": "The local reference engine prevents publication before its modeled gates pass and changes the active generation through a versioned compare-and-swap pointer.",
      "scope": "single-process SQLite publication oracle",
      "label": "LOCAL_VERIFIED",
      "requirement_ids": ["CB-PUBLISH-001", "CB-PUBLISH-002", "CB-PUBLISH-003"],
      "proof_refs": ["src/changebridge/cutover.py", "src/changebridge/engine.py", "tests/test_schema_and_cutover.py", "evidence/local-simulation.json"],
      "producing_commit": "d7e9cac800edfaf9e88f03dc6094ae07f43b496a",
      "producing_run": "35197120045",
      "limitations": "Managed multi-table consumer behavior is design-only; no atomic cross-Iceberg-table transaction is claimed.",
      "public_surfaces": [{"path": "README.md", "marker": "CB-CLAIM-004"}, {"path": "CLAIMS.md", "marker": "CB-CLAIM-004"}, {"path": "docs/INTERVIEW_WALKTHROUGH.md", "marker": "CB-CLAIM-004"}],
      "review_status": "APPROVED",
      "owner": "part1-stage2",
      "invalidation_conditions": ["cutover or pointer semantics change", "tests or evidence change"],
      "disposition": "CORRECTED"
    },
    {
      "id": "CB-CLAIM-005",
      "source_claim_ids": ["PC-005", "BC-004"],
      "approved_wording": "The deterministic local failure laboratory executes 13 named checks and reproduced byte-for-byte at the Stage 1 merged commit.",
      "scope": "local simulator",
      "label": "LOCAL_VERIFIED",
      "requirement_ids": ["CB-EVIDENCE-003"],
      "proof_refs": ["src/changebridge/simulator.py", "docs/failure-lab.md", "evidence/local-simulation.json", "evidence/part1/stage1/stage_receipt.json"],
      "producing_commit": "d7e9cac800edfaf9e88f03dc6094ae07f43b496a",
      "producing_run": "35197120045",
      "limitations": "The checks exercise local control-plane semantics only and do not invoke managed AWS services.",
      "public_surfaces": [{"path": "README.md", "marker": "CB-CLAIM-005"}, {"path": "docs/failure-lab.md", "marker": "CB-CLAIM-005"}, {"path": "CLAIMS.md", "marker": "CB-CLAIM-005"}, {"path": "docs/INTERVIEW_WALKTHROUGH.md", "marker": "CB-CLAIM-005"}],
      "review_status": "APPROVED",
      "owner": "part1-stage2",
      "invalidation_conditions": ["simulator check set or evidence changes", "documentation check names diverge"],
      "disposition": "CORRECTED"
    },
    {
      "id": "CB-CLAIM-006",
      "source_claim_ids": ["PC-006", "BC-007"],
      "approved_wording": "The Spark apply job now executes one manifest-bound local Iceberg CDC transaction with deterministic commit identity, receipt recovery, and checkpoint-last finalization.",
      "scope": "bounded local Stage 4 Spark/Iceberg apply job",
      "label": "LOCAL_VERIFIED",
      "requirement_ids": ["CB-APPLY-001", "CB-APPLY-002", "CB-APPLY-003", "CB-CHECKPOINT-001"],
      "proof_refs": ["jobs/spark_iceberg_apply.py", "src/changebridge/cdc_apply.py", "tests/integration/test_stage24_iceberg_cdc.py", "evidence/part2/stage4/validation-summary.json"],
      "producing_commit": "24c3ebbe7f56f30458fdeb0ea2cc8025131d7679",
      "producing_run": "stage24-local-spark-iceberg-proof",
      "limitations": "The proof is local and bounded; it is not AWS durability, atomic cross-table storage, distributed exactly-once delivery, or production readiness.",
      "public_surfaces": [{"path": "README.md", "marker": "CB-CLAIM-006"}, {"path": "CLAIMS.md", "marker": "CB-CLAIM-006"}, {"path": "docs/INTERVIEW_WALKTHROUGH.md", "marker": "CB-CLAIM-006"}],
      "review_status": "APPROVED",
      "owner": "part2-stage4",
      "invalidation_conditions": ["Spark adapter behavior changes", "real Iceberg apply implementation is added"],
      "disposition": "CORRECTED"
    },
    {
      "id": "CB-CLAIM-007",
      "source_claim_ids": ["PC-007", "BC-008"],
      "approved_wording": "Step Functions orchestration is an unimplemented target design: no state-machine definition, Terraform resource, test, or run evidence exists.",
      "scope": "orchestration",
      "label": "UNCLAIMED",
      "requirement_ids": ["CB-PUBLISH-001", "CB-OPS-002", "CB-OPS-003"],
      "proof_refs": [],
      "producing_commit": null,
      "producing_run": null,
      "limitations": "Architecture prose is not implementation or runtime evidence.",
      "public_surfaces": [{"path": "docs/architecture.md", "marker": "CB-CLAIM-007"}, {"path": "CLAIMS.md", "marker": "CB-CLAIM-007"}, {"path": "docs/INTERVIEW_WALKTHROUGH.md", "marker": "CB-CLAIM-007"}],
      "review_status": "UNCLAIMED",
      "owner": "part2-runtime",
      "invalidation_conditions": ["an implemented and tested state machine is merged"],
      "disposition": "FROZEN"
    },
    {
      "id": "CB-CLAIM-008",
      "source_claim_ids": ["PC-008", "BC-005"],
      "approved_wording": "Terraform is a partial design artifact whose formatting and validation have historical CI evidence; it is not managed deployment or end-to-end infrastructure proof.",
      "scope": "infra/terraform",
      "label": "DESIGN_ONLY",
      "requirement_ids": ["CB-SEC-001", "CB-SEC-002", "CB-OPS-003"],
      "proof_refs": ["infra/terraform/", ".github/workflows/terraform.yml", "evidence/part1/stage1/baseline_claims_matrix.json"],
      "producing_commit": "d7e9cac800edfaf9e88f03dc6094ae07f43b496a",
      "producing_run": null,
      "limitations": "Historical validation is not an apply, managed capability probe, security proof, or teardown record.",
      "public_surfaces": [{"path": "README.md", "marker": "CB-CLAIM-008"}, {"path": "CLAIMS.md", "marker": "CB-CLAIM-008"}, {"path": "docs/INTERVIEW_WALKTHROUGH.md", "marker": "CB-CLAIM-008"}],
      "review_status": "APPROVED",
      "owner": "part3-managed-proof",
      "invalidation_conditions": ["Terraform declarations or validation workflow change", "managed deployment proof is produced"],
      "disposition": "DOWNGRADED"
    },
    {